{
  "schemaVersion": 1,
  "eventId": "c_11111111111111111111111111111111",
  "writerId": "w_11111111111111111111111111111111",
  "type": "set_config",
  "baseEventIds": [],
  "occurredAt": "2026-08-22T09:00:00.000Z",
  "config": {
    "schemaVersion": 1,
    "daily": {
      "folder": "Daily",
      "dateFormat": "YYYY-MM-DD",
      "headings": ["## Memos"]
    },
    "monthly": {
      "folder": "Monthly",
      "fileFormat": "YYYY-MM.md",
      "dateHeadingFormat": "## YYYY-MM-DD",
      "dateOrder": "desc",
      "rendererVersion": 1
    }
  }
}
